,article url,title,article
0,https://sports.yahoo.com/nba-playoffs-cavaliers-stun-celtics-with-dominant-11894-win-in-game-2-at-boston-013648391.html,NBA playoffs: Cavaliers stun Celtics with dominant 118–94 win in Game 2 at Boston,"TheCleveland Cavaliersfinally won their first road game of the NBA playoffs, surprising theBoston Celticsand the TD Garden crowd with a118–94 win in Game 2 of their second-round Eastern Conference series. The series is tied at 1–1 going into Saturday's Game 3 at Cleveland.Early on, it looked like the Cavs might win a playoff game withoutDonovan Mitchellscoring the majority of their points. After averaging 39 points over Cleveland's past three playoff games, Mitchell had only six points at halftime. But he took over in the second half, scoring 16 in the third quarter and 29 for the game.Cleveland took control in the second half, outscoring the Celtics 64–40. With approximately five minutes remaining in the game, Boston head coach Joe Mazzulla conceded and put most of his bench on the court while the home fans headed for the exits.The Cavs fell behind by nine points in the first quarter, but roared back with an 11–0 run fueled byEvan Mobley's 11 points with help fromCaris LeVert's six off the bench. Cleveland took an 30–24 lead at the end of the quarter, quieting the Boston crowd.Caris showing off the VERTical!@CarisLeVert|#LetEmKnowpic.twitter.com/Whb7NyqnlF— Cleveland Cavaliers (@cavs)May 9, 2024Boston came back in the second quarter as Mobley and LeVert cooled off, while Mitchell andDarius Garlanddidn't look for their shots.Jayson Tatumled all first-half scorers with 16 points with six rebounds and four assists, though he shot 3-for-10 from the field.Al Horford's 11 points (with 4-for-5 shooting on 3-pointers) helped a rally that resulted in a 19–3 Celtics run and a halftime tie of 54–54.Mobley's scoring slowed down due to foul trouble, but he still finished with 21 points, 10 rebounds and five assists. LeVert provided a boost while Mitchell and Garland tried to warm up, adding 21 points and six rebounds. Garland added 14 points, andIsaac OkoroandMax Struseach scored 12.Tatum scored 25 points in total for the Celtics, but shot 7-for-17 from the field. No one else in Boston's lineup shot much better.Derrick Whitemanaged 10 points on 3-for-11 shooting (including 1-for-8 from 3).Jaylen Brownhad the best shooting night, going 7-for-15 to score 19 points.SPIDA IN HIS BAG TO END THE THIRD 😤🕷️(via@NBA)pic.twitter.com/2D4DD1O0rk— Yahoo Sports (@YahooSports)May 10, 2024Outside shooting has been an issue for the Cavaliers during the playoffs, but they had a 3-point shooting breakthrough in Game 3. Cleveland shot 46 percent (13-for-28) from behind the arc, led by Mitchell's 5-for-7 performance with Garland going 4-for-5. Strus added another two from 3-point range, with Mobley and Okoro each hitting one.Meanwhile, the Celtics struggled to shoot Thursday night. Boston shot 23 percent on its 3-point tries, going 8-for-35. Besides White's 1-for-8 night, Brown went 0-for-6 andJrue Holidayshot 0-for-2 as he continued his postseason struggles.Jarrett Allenmissed his fifth consecutive playoff game for the Cavs with a right rib contusion, whileKristaps Porzingishas been out for the Celtics' past two gameswith a calf injury.Game 3 of the Celtics-Cavaliers is scheduled for Saturday in Cleveland. Tip-off is 8:30 p.m. ET with the telecast on ABC.NFL first-round draft pick Terrion Arnold says the Las Vegas Raiders nearly took him with the No. 13 selection but opted for Brock Bowers on a coin flip. The Raiders deny that was the case.With the NBA Playoffs in full swing, fantasy basketball analyst Dan Titus examines the teams that are on the outside looking in to see what could bring better results next season.Beverley has since said about both incidents, ""I have to be better. And I will.""Fantasy baseball analyst Fred Zinkie breaks down matchups to target and avoid and much more for the end of Week 3.Draft week has arrived and with that comes our final installment of 'Mock Draft Mondays'. We go out with a bang as The Athletic's Dane Brugler joins Matt Harmon to share his five favorite picks in his latest seven-round mock draft. Yes, Brugler doesn't just put together 'The Beast' but a seven round mock. Everything you need to get ready for Thursday night.Jamal Murray was fined $100,000 by the league this week for throwing things onto the court in his team's loss to the Timberwolves on Monday.With more than two weeks of fantasy baseball data available to us, Dalton Del Don exposes the statistics we should be wary of.Georgia's star tight end, Brock Bowers, is the top prospect at his position, but will he be another Sam LaPorta for fantasy football? Andy Behrens gives his thoughts.Fantasy baseball analyst Scott Pianowski takes some time to answer some pressing questions in his latest mailbag.Fantasy baseball analyst Scott Pianowski breaks down some of the trickiest batters to gauge so far this season in the latest edition of The Buzz.Sanders put up impressive numbers in his first year at Colorado, but he displayed some bad habits that could hurt his future NFL Draft status.Fantasy baseball analyst Fred Zinkie offers up some big-picture trading tips before April wraps up, along with some key players to make moves on.Fantasy baseball analyst Scott Pianowski breaks down what he learned from a recent industry draft, one month into the 2024 MLB season.Starting pitchers in fantasy football have been compared to running backs in fantasy baseball — but have we made an error in not prioritizing relief pitchers more? Scott Pianowski investigates.Fantasy baseball analyst Andy Behrens offers up some updates from around the minor leagues, leading with yet another of Baltimore's top prospects.Jason Fitz, Charles Robinson and Frank Schwab talk about which quarterback rooms concern them and which they find interesting heading into the 2024 NFL season.Fantasy baseball analyst Dalton Del Don exposes some fraudulent statistics as we near the close of Week 4.Fantasy baseball analyst Fred Zinkie offers multiple key pieces of strategy for the final days of Week 4.Jake Fischer and Dan Devine discuss the Knicks taking a 2-0 lead over the Pacers, the Hornets hiring a new head coach and some big questions for the Bucks, 76ers, Clippers & Magic.With the fantasy basketball season in the books, Dan Titus looks back at how key rookies performed in the 2023-24 NBA season, and reveals where he'll draft them next season."
1,https://sports.yahoo.com/report-suns-fire-head-coach-frank-vogel-after-1st-round-playoff-sweep-eyeing-mike-budenholzer-as-replacement-202449030.html,"Report: Suns fire head coach Frank Vogel after 1st-round playoff sweep, eyeing Mike Budenholzer as replacement","ThePhoenix Sunsare moving on from head coach Frank Vogel.The Suns, after asweep at the hands of the Minnesota Timberwolvesin the first round of the playoffs earlier this spring, fired Vogel on Thursday afternoon, according to ESPN's Adrian Wojnarowski.ESPN Sources: The Phoenix Suns dismissed coach Frank Vogel. The Suns — who won 49 regular-season games with league’s third-highest payroll and tax — were swept in opening-round series to Timberwolves. Mike Budenholzer will be prominent part of search.pic.twitter.com/SDTRkXxkrG— Adrian Wojnarowski (@wojespn)May 9, 2024The ouster culminated a disappointing season that saw a Suns roster that addedKevin DurantandBradley Bealin the last two seasons finish sixth in the Western Conference before failing to secure a playoff victory. Vogel is done in Phoenix after a single season produced a 49-33 record.The Suns sacrificed depth in reconstructing their roster around All-NBA guardDevin Booker. Theytraded away key playersincludingMikal Bridgesand Cam Johnson to theBrooklyn Netsin addition to four first-round picks in order to acquire Durant during the 2022-23 season. Theydealt Chris Paul and Landry Shamet last offseasonto acquire Bradley Beal from theWashington Wizards.The deals depleted the Phoenix bench and left the Suns without a true point guard in the rotation. Instead, Booker and Beal — both primarily scoring guards — split time running the Suns offense.The Suns also lack size up front outside of starting centerJusuf Nurkić. That lack of size was exposed against the bigger Timberwolves, who feature multi-time All-StarsRudy GobertandKarl-Anthony Townsand Sixth Man of the YearNaz Reidon their front line. The Timberwolves secured a 46.3-32.5 advantage in rebounds per game over the Suns in their four-game series.The hope in Phoenix was that the top-heavy roster would lead to the Suns competing for a championship. Instead, it's become clear that it's not built to compete at the top of the Western Conference as constructed.Dismissing Vogel won't solve those roster woes. It does give the Suns a starting point to make adjustments in the offseason.Vogel is back on the job market after 19 seasons on NBA sidelines as an assistant or head coach. He's spent his last 12 NBA seasons as a head coach, including previous stints with theLos Angeles Lakers,Orlando MagicandIndiana Pacers. He coached the Lakers to an NBA championship in the 2019-20 season.The Suns, on the other hand, will now look for a third head coach in as many years.The Suns apparently wasted no time getting their coaching search started.FormerMilwaukee Buckshead coach Mike Budenholzer has emerged as the ""frontrunner"" to replace Vogel in Phoenix, Wojnarowski reported on Thursday afternoon. The report came just hours after the Suns fired Vogel.Budenholzer is the Suns’ target and talks are expected to move quickly, sources tell ESPN. He’s been working to assemble a coaching staff for a return to a head coaching job and that process is also gathering momentum, sources said.https://t.co/PSWPi9C6Pr— Adrian Wojnarowski (@wojespn)May 9, 2024Budenholzer was fired by the Bucks last spring after five seasons with the franchise, just two years after he led the team to their second NBA title. It marked his second head coaching job in the league, following a five-year run with theAtlanta Hawks. Budenholzer spent 17 seasons under Gregg Popovich as an assistant with theSan Antonio Spurs, too.Though the 54-year-old didn't coach this past season in the league, he's widely been considered a top candidate for an open job this offseason. He's from northern Arizona, too, which only adds to the fit for him with the Suns.Budenholzer is just being considered a ""frontrunner"" for the job as of Thursday afternoon, and it's still unclear when the Suns will make a decision or who else they are considering for the position.Finch collided with Mike Conley in the final two minutes of Minnesota's series-ending win over the Suns.Durant and Booker combined for 82 points. But Edwards again proved too much for the Suns to overcome.The Phoenix Suns pushed in all their chips to go nowhere.Anthony Edwards dropped 36 points in Phoenix.The Timberwolves are rolling even when their All-Stars struggle.The Phoenix Suns clinched the Western Conference's No. 6 seed in the NBA playoffs with a win over the Minnesota Timberwolves, coupled with the Los Angeles Lakers defeating the New Orleans Pelicans.Jake Fischer and Dan Devine discuss the Knicks taking a 2-0 lead over the Pacers, the Hornets hiring a new head coach and some big questions for the Bucks, 76ers, Clippers & Magic.Jason Fitz, Charles Robinson and Frank Schwab talk about which quarterback rooms concern them and which they find interesting heading into the 2024 NFL season.The No. 1 pick in the 2024 WNBA Draft is set for her preseason finale tonight.Keefe took over from Mike Babcock in November 2019.The 2024 Yankees have rediscovered their bravado and hold the second-best record in the AL, thanks in large part to the superstar outfielder.It’s unclear if the wager will actually hold up under the league’s gambling policy.The former Patriots head coach and the team's longtime owner met backstage before the show.The pair has been a perfect fit on the court, but it’s away from the game where the dynamic duo’s friendship was really forged.Fantasy baseball analyst Andy Behrens offers up a fresh batch of midweek pickups to consider, led by a former Dodgers prospect.Jamal Murray was fined $100,000 by the league this week for throwing things onto the court in his team's loss to the Timberwolves on Monday.If she can pull off a sixth straight win this week in New Jersey, Nelly Korda will set a new LPGA Tour record.On today's show, Dan Wetzel, Ross Dellenger and SI's Pat Forde talk college athletics revenue sharing, Brian Kelly complaining about not wanting to pay players, which teams are struggling to recruit, the Snoop Dogg Arizona Bowl, and a psychedelic commencement speaker.Skenes, the No. 1 pick in the 2023 MLB Draft, began this season in Triple-A.“I think it got pretty complicated and pretty messy.”"
2,https://sports.yahoo.com/nba-playoffs-knicks-rule-og-anunoby-out-for-game-3-vs-pacers-with-hamstring-injury-213757605.html,NBA playoffs: Knicks rule OG Anunoby out for Game 3 vs. Pacers with hamstring injury,"TheNew York Knickswill be withoutOG Anunobyon Friday night in Indianapolis.The Knicks ruled Anunoby out for their Game 3 matchup with theIndiana Pacersdue to a left hamstring strain, the team announced on Thursday afternoon.Anunoby went down in the second half of the Knicks’ 130-121 winover the Pacers on Wednesday night at Madison Square Garden. He was driving to the rim for a layup when he awkwardly pulled up at the backboard and started hopping under the basket. The game continued as he struggled near the baseline, and then he quickly limped off the court and directly to the locker room the next time the game was stopped.He didn’t return, and finished the night with 28 points while shooting 10-of-19 from the field. Anunoby, who was traded to the Knicks by the Raptors ahead of the deadline earlier this year, has averaged 14.1 points and 4.4 rebounds with the Knicks.It’s unclear how bad Anunoby’s hamstring injury is, or how long he will be sidelined. The team ruled him out of the game almost immediately on Wednesday, and there’s only a single day between games for him to rest and recover. Game 4 of the series is set for Sunday, though it’s unknown if he’ll be ready to go by then.While Anunoby is out, the Knicks listed starJalen Brunsonas questionable for Game 3.Brunson left Wednesday’s contestin the first quarter and missed all of the second period with a right foot injury. He returned in the second half, however, and ended up dropping 29 points to push the Knicks to a nine-point win.The Knicks hold a 2-0 series lead over the Pacers headed into Game 3. They are eying what would be their first Eastern Conference finals appearance since 2000."
3,https://sports.yahoo.com/brunson-leads-knicks-over-pacers-hornets-hire-charles-lee--big-questions-for-eliminated-teams--no-cap-room-211404027.html,"Brunson leads Knicks over Pacers, Hornets hire Charles Lee & big questions for eliminated teams | No Cap Room","On this episode ofNo Cap Room, Yahoo Sports senior NBA reporter Jake Fischer and Yahoo Sports senior NBA writer Dan Devine recap yet another close playoff win for theNew York Knicksover theIndiana Pacersfrom all angles.The guys discussJalen Brunsonreturning from injury to lead the team to victory,Josh Hartplaying every minute of every game, and even Pacers coach Rick Carlisle complaining about the refs and claiming that his small-market team is getting a raw deal because they’re playing against a large-market team in the NBA Playoffs.Speaking of coaches, Jake goes deep on how head coaches are employing challenges during the NBA Playoffs and how that usage differs from the regular season before talking about theCharlotte Hornetshiring Charles Lee as their new head coach and letting listeners in on some of the coaching rumors that he’s heard.Since the last episode ofNo Cap Room, four teams have been eliminated from the NBA Playoffs. The guys try to answer one important question for each one of them as a way to say goodbye to all of them.Should theBucksbe worried aboutGiannis’ age and injury history? What kind of player should the76ersacquire this offseason? Is it over for theClippers? And is itAnthony Blacktime inOrlando?All of that, and more, on this very fun episode ofNo Cap Room.🖥️Watch this full episode on YouTubeCheck out the rest of the Yahoo Sports podcast family athttps://apple.co/3zEuTQjor atYahoo Sports PodcastsNFL first-round draft pick Terrion Arnold says the Las Vegas Raiders nearly took him with the No. 13 selection but opted for Brock Bowers on a coin flip. The Raiders deny that was the case.Former NBA player Glen Davis was sentenced to 40 months in prison after his conviction for being involved in a scheme to defraud the league's healthcare plan.Sanders put up impressive numbers in his first year at Colorado, but he displayed some bad habits that could hurt his future NFL Draft status.Fantasy baseball analyst Fred Zinkie breaks down matchups to target and avoid and much more for the end of Week 3.Fantasy baseball analyst Andy Behrens offers up some updates from around the minor leagues, leading with yet another of Baltimore's top prospects.Jason Fitz, Charles Robinson and Frank Schwab talk about which quarterback rooms concern them and which they find interesting heading into the 2024 NFL season.Fantasy baseball analyst Scott Pianowski takes some time to answer some pressing questions in his latest mailbag.Andy Behrens has a fresh batch of priority pickups for fantasy managers looking to close out the week in strong fashion.Fantasy baseball analyst Dalton Del Don debuts The Scorecard, a weekly series featuring his takes on key MLB player notes.Fantasy baseball analyst Scott Pianowski breaks down some of the trickiest batters to gauge so far this season in the latest edition of The Buzz.Fantasy baseball analyst Fred Zinkie offers multiple key pieces of strategy for the final days of Week 4.Fantasy baseball analyst Andy Behrens offers up a series of pickups to assist every manager, starting with a duo of Rockies ahead of a Colorado homestand.It's another edition of 'Mock Draft Monday' on the pod and who better to have on then the face of NFL Network's draft coverage and a giant in the industry. Daniel Jeremiah joins Matt Harmon to discuss his mock draft methodology, what he's hearing about this year's draft class and shares his favorite five picks in his latest mock draft.Draft week has arrived and with that comes our final installment of 'Mock Draft Mondays'. We go out with a bang as The Athletic's Dane Brugler joins Matt Harmon to share his five favorite picks in his latest seven-round mock draft. Yes, Brugler doesn't just put together 'The Beast' but a seven round mock. Everything you need to get ready for Thursday night.Andy Behrens breaks down the next wave of fantasy football stars, ranking the incoming rookie class for dynasty drafters.Georgia's star tight end, Brock Bowers, is the top prospect at his position, but will he be another Sam LaPorta for fantasy football? Andy Behrens gives his thoughts.Fantasy baseball analyst Dalton Del Don exposes some fraudulent statistics as we near the close of Week 4.Carson Beck is entrenched as the Bulldogs' starter after a breakout 2023 season.With the fantasy basketball season in the books, Dan Titus looks back at how key rookies performed in the 2023-24 NBA season, and reveals where he'll draft them next season.With the NFL Draft in the books, fantasy football Matt Harmon breaks down the landing spots he loved to see, and those he's not a fan of."
4,https://sports.yahoo.com/2024-nba-playoffs-second-round-schedule-how-to-watch-tonights-games-where-to-stream-and-more-thursday-173731096.html,"2024 NBA Playoffs second round schedule: How to watch tonight's games, where to stream and more","The2024 NBA Playoffsare in full swing! After an action-packed first round, the NBA Playoffs continue in the second round tonight with Game 2 for theBoston Celticsvs.Cleveland CavaliersandOklahoma City Thundervs.Dallas Mavericks. The action tips off on ESON at 7 p.m. ET. Are you ready to watch? Here’s everything you need to know about tuning in to the NBA Playoffs tonight, including the full playoff schedule, NBA finals info and more.The first round of the NBA playoffs concluded on Sunday. Now, the action continues in the second round. Next up? Game 2 for No. 1 Boston Celtics vs. No. 4 Cleveland Cavaliers (7 p.m. on ESPN) and No. 1 Oklahoma City Thunder vs. No. 5 Dallas Mavericks (9:30 p.m. on ESPN).The NBA playoffs will air across ESPN, ABC, TNT and NBA TV.Max has been ""the one to watch"" for entertainment fans for quite some time, but now, it's drawing sports fans in, too. For a limited time, Max subscribers can get the new B/R Sports add-on totally free. That includes live NBA games on TBS, TNT, and truTV.All times EasternThursday, May 9, 2024Game 2: No. 1 Boston Celtics vs. No. 4 Cleveland Cavaliers - 7 p.m. (ESPN)Game 2 No. 1 Oklahoma City Thunder vs. No. 5 Dallas Mavericks - 9:30 p.m. (ESPN)Friday, May 10, 2024Game 3: No. 2New York Knicksvs. No. 6Indiana Pacers- 7 p.m. (ESPN)Game 3: No. 2 Denver Nuggets vs. No. 3 Minnesota Timberwolves - 9:30 p.m. (ESPN)Saturday, May 11, 2024Game 3: No. 1 Oklahoma City Thunder vs. No. 5 Dallas Mavericks - 3:30 p.m. (ABC)Game 3: No. 1 Boston Celtics vs. No. 4 Cleveland Cavaliers - 8:30 p.m. (ABC)Sunday, May 12, 2024Game 4: No. 2 New York Knicks vs. No. 6 Indiana Pacers - 3:30 p.m. (ABC)Game 4: No. 2 Denver Nuggets vs. No. 3 Minnesota Timberwolves - 8 p.m. (TNT)The NBA Finals begin Thursday, June 6.The NBA Finals will air on ABC.All times EasternThursday, June 6Game 1: 8:30 p.m. (ABC)Sunday, June 9Game 2: 8 p.m. (ABC)Wednesday, June 12Game 3: 8:30 p.m. (ABC)Friday, June 14Game 4: 8:30 p.m. (ABC)Monday, June 17Game 5: 8:30 p.m. (ABC)*Thursday, June 20Game 6: 8:30 p.m. (ABC)*Sunday, June 23Game 7: 8 p.m. (ABC)**if necessaryNikola Jokić joins a short list of the game's all-time greats after securing his third MVP.Minnesota keeps climbing up the NBA Finals odds.Murray tossed a heat pad onto the court during gameplay vs. the Timberwolves.Minnesota has made Denver look powerless in taking a dominant 2-0 lead as the series now shifts to the Target Center.Vincent Goodwill and The Athletic’s Fred Katz talk through the Cavaliers game 7 win on Sunday, the offseason ahead of the Magic (and Lakers) and preview the Knicks / Pacers 2nd round series.Donovan Mitchell scored 39 points to lead the Cleveland Cavaliers to a Game 7 victory over the Orlando Magic. The Cavaliers will face the Boston Celtics in the second round of the NBA playoffs.The Celtics had no issue closing out their opening-round playoff series with the Heat on Wednesday night.The Thunder did No. 1 seed things. The Celtics not so much.The Nuggets have won 11 straight games over the Lakers.We break down the first-round series between the Denver Nuggets and Los Angeles Lakers and make our series prediction.The Nuggets suddenly need some help if they want the No. 1 seed.The pair has been a perfect fit on the court, but it’s away from the game where the dynamic duo’s friendship was really forged.Frank Vogel's out after one season in Phoenix failed to produce a playoff win.Jason Fitz, Charles Robinson and Frank Schwab talk about which quarterback rooms concern them and which they find interesting heading into the 2024 NFL season.Beverley has since said about both incidents, ""I have to be better. And I will.""Jamal Murray was fined $100,000 by the league this week for throwing things onto the court in his team's loss to the Timberwolves on Monday.A disappointing April led Carroll and his Diamondbacks coaches to reexamine his swing mechanics and get back to his strengths.It’s unclear if the wager will actually hold up under the league’s gambling policy.The 2024 Yankees have rediscovered their bravado and hold the second-best record in the AL, thanks in large part to the superstar outfielder.As modern media becomes more niche driven, teams and even leagues have to balance whether to seek the biggest TV contracts or the biggest potential audience."
