,article url,title,article
5,https://sports.yahoo.com/nba-suspends-bucks-patrick-beverley-4-games-for-throwing-ball-at-fans-kicking-reporter-out-of-interview-180830598.html,"NBA suspends Bucks' Patrick Beverley 4 games for throwing ball at fans, kicking reporter out of interview","Patrick Beverleyof theMilwaukee Buckshas been suspendedfour games without pay by the NBAfor throwing a basketball at fans and for his interaction with an ESPN reporter after Game 6 of their first-round series against theIndiana Pacers.In the final minutes of the Bucks’ Game 6 loss to the Pacers, whichclosed out the seriesand sent the Pacers into the Eastern Conference semifinals,Beverley was seen throwing a balltoward Pacers fans and hitting a woman in the head. Beverley then waved at a different fan to throw the ball back to him, which he did, and then Beverley chucked the ball right back at him hard.Beverley kept jawing with fans behind their bench before teammates and others defused the situation. He was not ejected from the game, but he didn’t return. The Bucks were down by 20 points at the time.altercation between pat bev and pacers fans behind the benchpic.twitter.com/dfQpqSBv33— Rob Perez (@WorldWideWob)May 3, 2024""It's an unfortunate situation that should have never happened. What I did was bad and that should have never happened. I have to be better and I will be better,""Beverley said on his podcast this week.Beverley added that he reacted that way because of what was said to him by fans.''Regardless of what was said ... it was more than, 'Cancun on three,'"" Beverley said. ""Let's just say it was more than that. I've been called a lot of stuff in this league, I haven't been called that one. Still inexcusable, it doesn't matter what was said. I have to be better and I will be better.""Indianapolispolice are investigating the ball-throwing incidentbetween Beverley and the Pacers fans.Detectives confirmed the investigation to The Athletic on Wednesday, and said they are reviewing video footage from Gainbridge Fieldhouse and plan to speak with all parties. It’s unclear if they will pursue any criminal charges.The other reason Beverley is being suspended is because after the game,he refused to answer questionsfrom ESPN’s Malinda Adams in a media scrum because she didn’t subscribe to his podcast.Patrick Beverly tells female reporter from ESPN that she cannot interview him since she doesn't subscribe to his podcast.pic.twitter.com/sRFHiZJaSK— Alex Golden (@AlexGoldenNBA)May 3, 2024Beverley defended himself, saying on his podcast he's done that with other reporters in the past. But when he saw the clip go viral and criticism come his way, he reached out to Adams.""I've done that since I had a podcast,"" Beverley said of the interaction. ""...I instantly get her number, I call her. Ain't nobody tell me to call her. Like, I literally find her number, call her number, like, 'Hey, I know you probably getting a lot of people reaching out to you and I apologize about that. It was never my intent to disrespect you.' We got on the phone we laughed about it.""Beverley, who is an unrestricted free agent this summer, will serve his four-game suspension next season.Patrick Beverley threw a ball at Pacers fans multiple times in the final minutes of the Bucks' Game 6 loss earlier this month.The Pacers identified 29 plays from Game 1 and 49 plays from Game 2 they did not agree with.Jalen Brunson briefly went down with a foot injury in the first half on Wednesday night, and then returned to power the Knicks to a 2-0 series lead.Jalen Brunson scored 43 points, leading the New York Knicks to a 121–117 win over the Indiana Pacers in Game 1 of their second-round NBA playoff series.Vincent Goodwill and The Athletic’s Fred Katz talk through the Cavaliers game 7 win on Sunday, the offseason ahead of the Magic (and Lakers) and preview the Knicks / Pacers 2nd round series.The Bucks will be without Giannis Antetokounmpo and Damian Lillard for an elimination game on Tuesday night.Damian Lillard is doubtful to play in Game 4 of the Milwaukee Bucks' first-round NBA playoff series with the Indiana Pacers. Lillard suffered an Achilles injury on a drive to the basket in Game 3.Tyrese Haliburton hit a floater with 1.1 seconds left in overtime to give the Indiana Pacers a 121–118 win over the Milwaukee Bucks. The Pacers lead their first-round playoff series two games to one.Pascal Siakam droped 37 points to help the Pacers fend off Damian Lillard and tie up their playoff series 1-1.Welcome back to the playoffs, Damian Lillard.The No. 1 pick in the 2024 WNBA Draft is set for her preseason finale tonight.Frank Vogel's out after one season in Phoenix failed to produce a playoff win.Jason Fitz, Charles Robinson and Frank Schwab talk about which quarterback rooms concern them and which they find interesting heading into the 2024 NFL season.The gambling scandal involving Shohei Ohtani's former interpreter, Ippei Mizuhara, who stole $17 million from the superstar to cover betting losses, is in development as a TV series.The 2024 Yankees have rediscovered their bravado and hold the second-best record in the AL, thanks in large part to the superstar outfielder.The pair has been a perfect fit on the court, but it’s away from the game where the dynamic duo’s friendship was really forged.A disappointing April led Carroll and his Diamondbacks coaches to reexamine his swing mechanics and get back to his strengths.Keefe took over from Mike Babcock in November 2019.The Charlotte Hornets announced on Thursday morning that it hired Boston Celtics assistant Charles Lee, who will join the team once Boston's playoff run is complete.As modern media becomes more niche driven, teams and even leagues have to balance whether to seek the biggest TV contracts or the biggest potential audience."
6,https://sports.yahoo.com/former-nba-player-glen-davis-sentenced-to-40-months-in-prison-for-involvement-in-healthcare-fraud-scheme-190328457.html,Former NBA player Glen Davis sentenced to 40 months in prison for involvement in healthcare fraud scheme,"Former NBA player Glen Davis was sentenced to 40 months in prison Thursday, plus three years of supervised release, following his November 2023 conviction for involvement in a scheme to defraud the league's healthcare plan.Davis is one of 20 people, including other former players likeWill Bynum, Terrence Williams and Keyon Dooling, who were indicted for filing false reimbursement claims to the NBA's health and welfare benefit plan for medical care and procedures that were never actually performed.Davis and Bynum were convictedby a Manhattan jury last November.According to a statementby the Southern District of New York when the convictions were made, those involved in the scheme netted over $5 million in illicit profits. Davis submitted $132,000 worth of claims, including $27, 200 worth of dental work in Beverly Hills, when authorities were able to prove from cellphone data that he was actually in Las Vegas at the time,according to USA Today.Davis was convicted of health care fraud, wire fraud, conspiracy to make false statements and conspiracy to commit health care and wire fraud. He faced up to 20 years in prison.In addition to his prison sentence, Davis was ordered to pay $80,000 in restitution. Among the conditions of his supervised release are attending a financial management class and mandatory drug treatment.Davis played eight seasons in the NBA, averaging eight points and 4.4 rebounds per game with theBoston Celtics,Orlando MagicandLos Angeles Clippersduring his career. His best season was 2012-13, when he averaged 15.1 points, 7.2 rebounds and 2.1 assists for the Magic.A second-round pick in the 2007 NBA Draft out ofLSU, Davis was a member of the Celtics'2008 NBA championship teamand finished fourth in Sixth Man of the Year voting in 2011-12.In April, Bynum, an eight-year NBA veteran, wassentenced to 18 months in prisonand was ordered to pay $183,000 in restitution.Jake Fischer and Dan Devine discuss the Knicks taking a 2-0 lead over the Pacers, the Hornets hiring a new head coach and some big questions for the Bucks, 76ers, Clippers & Magic.Jalen Brunson is considered questionable for Friday’s game in Indianapolis.The gambling scandal involving Shohei Ohtani's former interpreter, Ippei Mizuhara, who stole $17 million from the superstar to cover betting losses, is in development as a TV series.NFL first-round draft pick Terrion Arnold says the Las Vegas Raiders nearly took him with the No. 13 selection but opted for Brock Bowers on a coin flip. The Raiders deny that was the case.Beverley has since said about both incidents, ""I have to be better. And I will.""The pair has been a perfect fit on the court, but it’s away from the game where the dynamic duo’s friendship was really forged.Jason Fitz, Charles Robinson and Frank Schwab talk about which quarterback rooms concern them and which they find interesting heading into the 2024 NFL season.As part of a new proposal, power conference leaders are considering reducing football rosters from more than 115 to as few as 85 players.The 2024 Yankees have rediscovered their bravado and hold the second-best record in the AL, thanks in large part to the superstar outfielder.A disappointing April led Carroll and his Diamondbacks coaches to reexamine his swing mechanics and get back to his strengths.Help has already arrived for Memphis, which should join an even more competitive Western Conference next season.The Yahoo Fantasy football crew got together for their very first mock draft of 2024. Andy Behrens recaps the results.As modern media becomes more niche driven, teams and even leagues have to balance whether to seek the biggest TV contracts or the biggest potential audience.Fantasy baseball analyst Fred Zinkie offers up his blueprint for conquering the final days of Week 6.Nonexistent negotiations and missed opportunities for reconciliation between the PGA Tour and LIV Golf have the sport stuck in place.Fantasy baseball analyst Andy Behrens offers up a fresh batch of midweek pickups to consider, led by a former Dodgers prospect.Nikola Jokić joins a short list of the game's all-time greats after securing his third MVP.The Nuggets superstar joined exclusive company with his third NBA MVP award, which comes with unfair responsibility.Ippei Mizuhara agreed to plea guilty to a pair of charges after he stole nearly $17 million from Shohei Ohtani to help cover up gambling losses.The franchise is heading into an enormous summer in regard to picking a direction and mapping out a plan for the future."
7,https://sports.yahoo.com/is-pacers-coach-rick-carlisle-right-to-be-upset-about-officiating-in-knicks-series-and-a-big-market-bias-170107831.html,Is Pacers coach Rick Carlisle right to be upset about officiating in Knicks series and a big-market bias?,"It wouldn’t be the playoffs we know and love without some campaigning and allegations that something nefarious is at work with officiating.Madison Square Garden, a rowdy and desperateKnickscrowd, theIndiana Pacerson the other end and a national TV audience.Are we sure we’re not done with the '90s?Pacers coach Rick Carlisle took to his pulpit afterhis team blew Game 2 to the Knicks, putting them in a 2-0 hole before heading home to Indianapolis. No doubt he was frustrated after two games of some shoddy officiating, some moments those refs would like to have back and a couple of unforgivable calls that went the Knicks’ way.ThePacers sent in several dozen plays to the league officethey considered questionable, which is standard practice for teams following games. It happens all the time, except in this case, the Knicks will be able to see exactly what the Pacers sent in as opposed to it being a bit more clandestine.Carlisle wasn’t coy about how he felt his team was officiated and the possible motives behind it.“I’m always talking to our guys about not making it about the officials … but we deserve a fair shot,” Carlisle said. “There’s not a consistent balance, and that’s disappointing. Their physicality is rewarded and ours is penalized.”And then, the coup de grâce. Carlisle exploded when a double-dribble on Knicks centerIsaiah Hartensteinwas called back, he believes, simply because Knicks coach Tom Thibodeau said Hartenstein didn’t commit the infraction.Now, it didn’t appear Hartenstein double-dribbled, but never — and emphasis on ""never"" — do you see a coach get a call like that changed once the whistle blows.“That’s small beans compared to everything else,” Carlisle said. “Small-market teams deserve an equal shot. Deserve a fair shot, no matter where they’re playing.”If the cause is to get the call right, then Carlisle has a huge point on that micro example. But given what occurred in Game 1, when the Pacers really have a case of being wronged, that logic wasn’t applied when officials incorrectly called a kick ball on the Pacers whenAaron Nesmithcleanly got his hand on a pass fromJalen Brunsonduring a tied game with 52.1 seconds left.The call couldn’t be reviewed, and instead of a 4-on-2 fast break for the Pacers, the Knicks received the ball back, thenDonte DiVincenzohit a triple to put the Knicks up, leading to a win.Carlisle is taking a page from the Phil Jackson, Chuck Daly, Pat Riley, brothers Van Gundy playbook and exerting some pressure to a league that is very sensitive about perceived biases toward a team like the Knicks.The aforementioned coaches tweaked the league and worked the officials in days between games, a clear agenda to bring attention to the officiating crews who’d work the next games. It was part entertainment, part strategy, and we all leaned into it.It’s fun, and everybody loves a good conspiracy theory, especially when there’s evidence to back up the claims. The thesis just might not be correct.Carlisle refused to blame the officiating following Game 1, then looked at the high road two days later and went a step away from nuclear.Whether he fully believes it or not, Carlisle and other coaches around the league know who’s being talked about nationally, what teams receive the bulk of media and television coverage around the league, and it seeps into their minds. And Carlisle, as president of the coaches association, knows he can't levy serious claims to the integrity of the game.The NBA doesn’t control what ESPN talks about, and consciously, Carlisle is smart enough to know that. TheLakersget the ""A"" block, even when they’re nowhere near the playoffs.OrlandoandClevelandand Indiana, nobody knows they exist given the television coverage and, yes, sometimes in this space as well.And when you continuously hear on broadcasts, “The NBA is so much better when the Knicks are relevant,” it’s hard to ignore — even if you ignore the fact the Knicks have been to a grand total of one Eastern Conference final since 1999.There’s no denying Madison Square Garden is electric in the springtime, and for the TV visual it looks like an intoxicating environment. The Pacers have a charm, but it’s always been as a small-market foil to the likes of the Knicks,Bullsand even theMiami HeatwhenLeBron Jameswas there.Good versus not-so-good, famous versus unknown, it’s a tale as old as time, and it makes for a compelling lead-in.From a pure basketball standpoint, though, it gets more complicated. The Knicks are an undermanned, rough-and-tumble bunch who play physical at every spot on the floor, starting with their bulldog of a point guard, Jalen Brunson.He lowers his shoulder and knocks opposing guards off his body like a bowling ball to pins, and he’s done that all year — like the Knicks have.The Pacers were built like a race car, in the ways the game was officiated in the first half of the season. Small contact was rewarded and physical play was legislated out of the game even more.But in the second half of the year, the pendulum swung and teams like the Knicks could be more handsy — and once you establish a style, a physical one, you’re probably given more leeway by the officials subconsciously.It can be difficult to change officiating patterns midstream in a season, especially when officials are trained and drilled in the offseason and implementing change in the preseason while gradually adjusting.And the games have been better and more compelling than the ticky-tack calls we’ve seen over the last couple years. It’s a welcome change.However, strange things have happened with the Knicks at Madison Square Garden this season when games were close.PistonsrookieAusar Thompsonwas essentially speared on the sideline by DiVincenzo with the Pistons holding a one-point lead and 6.9 seconds remaining, in full view of the official who was more spectator than someone doing his job.The Knicks scored on that play, won that game and of course, like in Game 1, the officials admitted their mistake in the immediate aftermath but nothing could be done.The two-minute report frustrates everyone because it doesn’t change what we’ve seen from a million angles the night before, and the last thing anyone wants to see is officials succumb to human error and interrupt competitive, compelling games.Whistles blown, whistles swallowed, it comes in all forms. It’s not necessarily about free-throw disparity but consistency in calls — likeMyles Turner’s questionable offensive foul on a screen where, yes, DiVincenzo was again in the middle of it. The Knicks' talented swingman appeared to flop and, while Turner wasn’t completely set, the contact wasn’t anywhere near egregious — especially compared to the previous play where DiVincenzo leaned in on Nesmith and tangled his arms on a screen to free up Brunson.That was the play where Brunson threw an errant pass and it was ruled a Knick-ball, or kickball.DiVincenzo seems to be everywhere, doesn’t he?But bad calls don’t have to equal a conspiracy on part of the league office or the officiating crew. Carlisle has the right to pull that lever, even when a fine could be coming, to at least plant the seed in everyone’s minds what to watch out for as the series changes venues.The Pacers can’t change who they are, and while the Knicks are steadily running out of bodies, they won’t change who they are.Human nature can’t be changed, but you just hope our eyes and our biases aren’t seeing the same things.Jake Fischer and Dan Devine discuss the Knicks taking a 2-0 lead over the Pacers, the Hornets hiring a new head coach and some big questions for the Bucks, 76ers, Clippers & Magic.Jalen Brunson is considered questionable for Friday’s game in Indianapolis.The Knicks have been more aggressive utilizing challenges early in games, and they led the league in total challenges and successful challenges during the first round of the NBA playoffs.Tuesday's last-2-minute report should be interesting.The 76ers will reportedly make the argument that they have ""been disadvantaged more than any other team"" in the league when it comes to officiating so far in the playoffs.Beverley has since said about both incidents, ""I have to be better. And I will.""Frank Vogel's out after one season in Phoenix failed to produce a playoff win.The No. 1 pick in the 2024 WNBA Draft is set for her preseason finale tonight.The gambling scandal involving Shohei Ohtani's former interpreter, Ippei Mizuhara, who stole $17 million from the superstar to cover betting losses, is in development as a TV series.Jason Fitz, Charles Robinson and Frank Schwab talk about which quarterback rooms concern them and which they find interesting heading into the 2024 NFL season.The 2024 Yankees have rediscovered their bravado and hold the second-best record in the AL, thanks in large part to the superstar outfielder.Keefe took over from Mike Babcock in November 2019.The Charlotte Hornets announced on Thursday morning that it hired Boston Celtics assistant Charles Lee, who will join the team once Boston's playoff run is complete.As modern media becomes more niche driven, teams and even leagues have to balance whether to seek the biggest TV contracts or the biggest potential audience.The pair has been a perfect fit on the court, but it’s away from the game where the dynamic duo’s friendship was really forged.Teams have made their big splashes in free agency and made their draft picks, it's time for you to do the same. It's fantasy football mock draft time. Some call this time of year best ball season, others know it's an opportunity to get a leg up on your competition for when you have to draft in August. The staff at Yahoo Fantasy did their first mock draft of the 2024 season to help you with the latter. Matt Harmon and Andy Behrens are here to break it all down by each round and crush some staff members in the process.Vincent Goodwill and Tom Haberstroh talk about the Thunder and Celtics taking game 1 of their series and discuss issues with NBA officiating.Kelly said LSU hasn't ""fared very well"" in its attempts to add transfer defensive linemen.If she can pull off a sixth straight win this week in New Jersey, Nelly Korda will set a new LPGA Tour record.Ippei Mizuhara agreed to plea guilty to a pair of charges after he stole nearly $17 million from Shohei Ohtani to help cover up gambling losses."
